id,collection,dc.title[en_US],dc.contributor.author[en_US],dc.description.abstract[en_US],dc.publisher,dc.date.issued,dc.identifier.doi,dc.identifier.issn,dc.subject,dc.language,dc.type,dc.publisher.volume,dc.publisher.issue,dc.publisher.page,dc.identifier.uri
+,123456789/795,Asiaticoside Induces Cell Proliferation and Collagen Synthesis in Human Dermal Fibroblasts,"Bramono, Kusmarinah||Mardliyati, Etik||Yulianti, Linda||Freisleben, Hans Joachim","Asiatiocoside, a saponin component isolated from Centella asiatica can improve wound healing by promoting the proliferation of human dermal fibroblasts (HDF) and synthesis of collagen. The skin-renewing cells and type I and III collagen synthesis decrease with aging, resulting in the reduction of skin elasticity and delayed wound healing. Usage of natural active compounds from plants in wound healing should be evaluated and compared to retinoic acid as an active agent that regulates wound healing. The aim of this study was to compare and evaluate the effect of asiaticoside and retinoic acid to induce greater cell proliferation and type I and III collagen synthesis in human dermal fibroblast. Methods Laboratory experiments were conducted using human dermal fibroblasts (HDF) isolated from human foreskin explants. Seven passages of HDF were treated with asiaticoside and retinoic acid at several doses and incubated for 24 and 48 hours. Cell viability in all groups was tested with the MTT assay to assess HDF proliferation. Type I and III collagen synthesis was examined using the respective ELISA kits. Analysis of variance was performed to compare the treatment groups. Results Asiaticoside had significantly stronger effects on HDF proliferation than retinoic acid (p<0.05). The type III collagen production was significantly greater induction with asiaticoside compared to retinoic acid (p<0.05). Conclusion Asiaticoside induces HDF proliferation and type I and III collagen synthesis in a time- and dose-dependent pattern. Asiaticoside has a similar effect as retinoic acid on type I and type III collagen synthesis.",Universa Medicina,2015,10.18051/UnivMed.2015.v34.96-103,2407-2230,Asiaticoside||Type I Collagen||Type III Collagen||Fibroblast||Proliferation||Retinoic Acid,en,Journal Article,34,2,96-103,https://univmed.org/ejurnal/index.php/medicina/article/view/24
+,123456789/795,Atypical Mycobacterial Infection Mimicking Carbuncle in an Elderly Patient: A Case Report,"Barros, Terlinda||Legiawati, Lili||Yusharyahya, Shannaz Nadia||Sularsito, Sri Adi||Wihadi, Imelda ","Background: Atypical mycobacterium infection occurs under certain skin conditions, namely the disruption of skin integrity and mucous membranes accompanied by the reduction of cellular immunity. However, atypical mycobacterial infection in elderly patients is rarely reported.||Case: A 64 years old male patient, complained of red lumps on the upper-backfor a month, accompanied by mild fever and minimal pain. Three months before, the patient had accupuncture on the neck and upper back. Physical examination showed multiple miliar to lenticular sized papules and pustules on an erythematous-violaceus base with hard and immobile palpable nodes and infiltrate. After clinical and laboratory workup, the patient was diagnosed withcarbuncle with Candida spp colonization. The treatment consisted of systemicantibiotics and topical antifungals. There was no clinical improvement after 3 weeks. Histopathology and laboratory results suggested atypical mycobacterium infection.||Discussion: Atypical mycobacterium infection should be considered in elderly patients with skin and soft tissue infections that show no clinical improvement tostandard therapy.",Journal of General-Procedural Dermatology & Venereology Indonesia,2015,10.19100/jdvi.v1i1.7,2460-7991,Skin and Soft Tissue Infection||Atypical Mycobacterium||Geriatric Patients,en,Journal Article,1,1,33-35,http://jgenprodvi.ui.ac.id/index.php/jdvi/article/view/7/pdf
+,123456789/819,Deep Anterior Lamellar Keratoplasty as an Alternative Treatment on Granular Corneal Dystrophy,"Martha, Faraby||Harmani, Bondan||Shidik, Amir||Gondhowiardjo, Tjahjono D.","Introduction: Granular corneal dystrophies (GCD) is an autosomal dominant corneal disorder with bilateral visual disturbances. Deep anterior lamellar keratoplasty (DALK) was recently introduced as an alternative to keratoplasty. This case report mentions DALK as treatment modality for management of young patient with GCD.||Case Report: A 24-year old Indonesian man presented with bilateral progressive visual loss since he was fifteen years of age. His bilateral best visual acuity was half meter finger counting. Slit lamp examination on both eyes revealed diffuse hazy corneas with bilateral opacities and multiple granular Bowman’s plane and anterior half of stroma. The patient was diagnosed as having a granular corneal dystrophy of both eyes and DALK was performed with manual lamellar dissection technique on his right cornea. The same size of donor cornea was triphaned 1/2 depth and put on top of host bare cornea, then nylon 10-0 was sutured. Two week after procedure, best corrected visual acuity in right eye improved to 6/40.||Conclusion: DALK is an alternative procedure for management of patients with GCD whose corneal endothelium is not compromised.",Journal of Case Report,2015,10.17659/01.2015.0086,,Cornea||Corneal Dystrophies||Endothelium||Visual Aquity||Corneal Transplantation,en,Journal Article,5,2,334-339,http://www.casereports.in/printerfriendly.aspx?id=496
+,123456789/819,Folliculitis Extending into Preseptal Cellulitis and Abscess in Children,"Susiyanti, Made||Ratnasari, Monika||Nora, Rina La Distia ","Objectives: To report a rare and complicated case of folliculitis extending into preseptal and orbital abscess in a young boy.||Case Report: An 11 month-old boy presented with frontal mass since 7 days and swelling, redness and pain of left eye since 3 days. A multidisciplinary approach was undertaken to find the etiology of infection, rule out malignancy, and confirm the diagnosis. Orbital MRI with contrast revealed cellulitis with multifocal abscess at the left eyelid, fronto-nasal region, and intra-orbitally. The patient underwent incisional biopsy and drainage of the abscess after 10 days of intravenous antibiotic and steroid resulting in only mild improvement. Histopathologic examination confirmed of abscess and culture revealed Staphylococcus aureus. Two months later, eyelid swelling completely resolved and visual acuity were 6/12 OU.||Conclusion: Multidisciplinary assessment is required to differentiate preseptal or orbital cellulitis and malignancy, especially in children. Aggressive intravenous antibiotics with steroid therapy are required to control infection. Surgical intervention must be promptly undertaken when there is no significant clinical improvement with conservative management or if there is evidence of abscess.",Journal of Case Report,2015,,,Folliculitis||Orbital Cellulitis||Orbital Cellulitis||Abscess||Staphylococcus Aureus||Antibiotics||Drainage||Humans,en,Journal Article,5,1,45-52,http://www.casereports.in/printerfriendly.aspx?id=423
+,123456789/819||123456789/724||123456789/697,Diagnostic Value of Contrast Sensitivity Test and Conjunctival Impression Cytology for the Detection of Sub-Clinical Vitamin-A Deficiency,"Gondhowiardjo, Tjahjono Darminto||Andriyani, Irma||Gumay, S||Artini, Widya||Werdhana, R.A. ","Purpose: To determine whether or not contrast sensitivity test and conjunctival impression cytology can be used as diagnostic tools to detect sub-clinical vitamin-A deficiency;and if there is a correlation within the two diagnostic methods.||Methods: A series of diagnostic studies comprising of contrast sensitivity test, conjunctival impression examination and serum retinol concentration were performed on literate children, six to ten years old, at West Java Elementary School. All subjects underwent a basic eye examination. Sample size, receiver operator curve, negative and positive predictive values, sensitivity and specificity were calculated.||Results: A total of 109 subjects out of 154 elementary school children corresponding to the inclusion criteria were included in this study. Forty-four (41.9%) children were detected to have sub-clinical vitamin-A deficiency. The contrast sensitivity test had a sensitivity value of 45.5% and a specificity value of 50.8% with a positive predictive value of 40%. The area under the receiver operator characteristic (ROC) curve was 49.5% (95% CI 38.1%-60.9%), whereas the conjunctival impression cytology test had a sensitivity value of 90.9%, and a specificity value of 16.4% with a positive predictive value of 43.9%. The ROC area was 56.1% (95% CI 45.0% - 67.1%). Pearson’s analysis showed that there is no correlationbetween the two diagnostic tools (p 0.538).||Conclusion: The results of this study indicated that neither the contrast sensitivity test nor the conjunctival impression cytology was found to be a favorable screening tool to detect sub-clinical vitamin-A deficiency. Moreover, there is no correlation between the two methods.",Asian Journal of Ophthalmology,2014,,,,en,Journal Article,13,4,131-140,https://www.asianjo.com/index.php/AsianJO/article/view/168
+,123456789/805,"Angiogenesis, Inflammation, Platelets Count, and Metastatic Status as a Predictor for Thrombosis Risk in Nasopharyngeal Carcinoma Patients","Sudoyo, Aru W||Rachman, Andhika||Harimurti, Kuntjoro ","Aim: to assess the use of of angiogenesis, inflammation, platelets count, and metastatic status as predictors for thrombosis risk represented by soluble P-selectin level in nasopharyngeal carcinoma (NPC) patients.||Methods: a cross sectional study was conducted on NPC patients at the Hematology and Oncology Clinic of Cipto Mangunkusumo Hospital, Jakarta, during Mei to October 2012. Data regarding angiogenesis (CD105 and VEGFR-2), inflammation (IL-6), platelets count, and metastatic status were assessed at enrollment, as well as soluble P-selectin levels in all eligible patients. Bivariate analysis continued with multiple linear regression analysis were done to identify independent predictors for soluble P-selectin levels.||Results: sixty NPC patients were enrolled in the study. There was correlation between platelet counts (r=0.389; p=0.002), IL-6 (r=0.595; p<0.001) and number of metastatic sites (r=0.542; p<0.001) with soluble P-selectin level, and a linear regression analysis showed that these three variables can predict soluble P-selectin levels with adjusted R-square 65%. There was no correlation between VEGFR-2 and CD105 levels with soluble P-selectin levels.||Conclusion: platelet counts, IL-6 level, and number of sites of metastasis can be used as predictors of soluble P-selectin level as parameter of thrombosis risk in NPC patients.",Acta Medica Indonesiana,2015,,0125-9326,Nasopharyngeal Carcinoma (NPC)||Thrombosis Risk||Soluble P-selectin,en,Journal Article,47,1,15-Nov,http://www.inaactamedica.org/archives/2015/25948762.pdf
+,123456789/805,Colonoscopy Preparation: Efficacy and Efficiency of Hospitalmade Polyethylene Glycol (PEG) Compared with Commercial PEG,"Makmun, Dadang||Abdullah, Murdani||Syam, Ari Fahrial||Fauzi, Achmad||Renaldi, Kaka||Simadibrata, Marcellus||Rani, Aziz||Idayanti","AIM: Colorectal cancer is the third most deadly cancer worldwide, and colonoscopy is an effective method for screening for this cancer. Reducing the cost of colonoscopy could help increase adherence of patients with indications for this disease. The aim of this study was to compare the efficacy and cost-effectiveness for bowel clearance between hospital-made polyethylene glycol and the commercial product.",Journal of Gastroenterology and Hepatology Research,2015,10.17554/j.issn.2224-3992.2015.04.505,2224-3992,Colorectal Neoplasms||Bowel Preparation Solutions||Cost-Effectiveness||Polyethylene Glycol,en,Journal Article,4,2,1470-1473,http://www.ghrnet.org/index.php/joghr/article/view/979/1184
+,123456789/805,Combination of Aspartate Aminotranferase and Tumor Necrosis Factor-a as Non Invasive Diagnostic Tools for Non Alcoholic Steatohepatitis (NASH),"Daldiyono||Purnomo, Hery D||Mundhofir, Farmaditya EP||Kasno||Sudijanto, Eddy||Darmono||Djokomoeljanto, R||Faradz, Sultana MH","Aim: to develop a non-invasive diagnostic test for non-alcoholic steatohepatitis NASH.||Methods: this is a cross-sectional study on non-alcoholic fatty liver disease (NAFLD) subjects. Sample was taken by consecutive sampling method. Diagnostic criteria of NAFLD were confirmed by liver biopsy. Clinical variables include metabolic syndrome, aspartate aminotransferase (AST), alanine aminotransferase (ALT), adiponectine, TNF-a, insulin, homeostatic model assessment insulin resistance (HOMA-IR) index and liver biopsy. Patients were divided into two groups based on their liver biopsy, group 1: Non-NASH (NAFLD activity score <3) and group 2: NASH (NAFLD activity score of >4). Statistical analyses were performed using Student’s t-test, Mann Whitney U, chi-square, the ROC curve, sensitivity and specificity test.||Results: fifty NAFLD patients were recruited, 30 males and 20 females. Among these patients, 12 (24%) had type 2 diabetes, 36 (72%) had metabolic syndrome, the remaining 2 (4%) did not fulfilled metabolic syndrome. Liver biopsy confirmed 21 (42%) non- NASH and 29 (58%) NASH respectively. Level of AST and ALT, plasma level of adiponectine and TNF-a were statistically different between two groups. The AST level (>25 U/L) in combination with TNF-a (>3.28 pg/cc) demonstrated a good diagnostic accuracy for NASH (Accuracy 82%, Sensitivity 76%, Specificity 90%, PPV 92%, and NPV 73%).||Conclusion: the combined diagnostic tests of AST and TNF-a plasma levels demonstrated a good accuracy for the detection of NASH among NAFLD patients. This combination test can be used as a noninvasive method to diagnose NASH.",Acta Medica Indonesiana,2015,,0125-9326,AST||TNF-a||Diagnostic Test||NASH,en,Journal Article,47,1,16-23,http://www.inaactamedica.org/archives/2015/25948763.pdf
+,123456789/805,Combination Therapy with Telmisartan and Oxacalcitriol Suppresses the Progression of Murine Adriamycin Nephropathy,"Lydia, Aida||Jeong, K H||Asanuma, K||Takagi, M||Asao, R||Kodama, F||Asanuma, E||Tomino, Y ","Background: Blockade of the renin-angiotensin system plays a key role in suppressing the progression of renal diseases. It has not been well established whether this therapy provides additional effects when combined with vitamin D or its analog in a model of adriamycin (ADR)-induced nephropathy.||Methods: We evaluated the effect of an angiotensin II subtype 1 receptor blocker (telmisartan) combined with a vitamin D analog (oxacalcitriol) on mice ADR-induced nephropathy (9.5 mg/kg single intravenous injection). We also tested immortalized murine podocytes to examine the effects on podocyte apoptosis.||Results: Mice with ADR-induced nephropathy developed progressive albuminuria and glomerulosclerosis within 30 days accompanied by decreased expression of slit diaphragm (SD)-associated proteins (nephrin and podocin), reduced numbers of podocytes, and increased systolic blood pressure. Treatment with telmisartan or oxacalcitriol alone moderately ameliorated kidney injury. The combined treatment most effectively reduced the albuminuria and glomerulosclerosis. These effects were accompanied by the restoration of SD-associated proteins, reduction of podocyte apoptosis, and prevention of podocyte depletion in the glomeruli. Treatment with telmisartan, oxacalcitriol, and the combination therapy resulted in similar reductions in systolic blood pressure. In cultured murine podocytes, ADR stimulated the expression of Bax/Bcl-2 and apoptosis as determined by Hoechst 33342 staining. These changes were effectively inhibited by telmisartan or oxacalcitriol, but the combination treatment most effectively reduced these effects.||Conclusions: These data demonstrated that application of a renin-angiotensin system blocker plus a vitamin D analog effectively prevented renal injury in ADR-induced nephropathy. The observed amelioration of renal injury may be partly attributable to antiapoptotic effects in podocytes.",Nephron,2015,10.1159/000369346,1660-8151,Adriamycin Nephropathy||AT1 Receptor Antagonist||Podocyte||Vitamin D Analog,en,Journal Article,129,2,143-154,https://www.karger.com/DOI/10.1159/000369346
+,123456789/805,Development of Non-Alcoholic Fatty Liver Disease Scoring System Among Adult Medical Check-Up Patients: A Large Cross-Sectional and Prospective Validation Study,"Lesmana, Cosmas Rinaldi A||Pakasi, Levina S||Inggriani, Sri||Aidawati, Maria L||Lesmana, Laurentius A","BACKGROUND: Non-alcoholic fatty liver disease (NAFLD) is the most common liver disease in the community. However, NAFLD remains undiagnosed in most people with limited access to imaging facilities in most developing countries.||OBJECTIVE: To examine the prevalence of NAFLD and to develop the risk scoring model for predicting the presence of NAFLD among adult medical check-up patients.||METHOD: A large prospective cross-sectional study was conducted among medical check-up patients who underwent transabdominal ultrasound examination between January and December 2013 in Medistra Hospital, Jakarta. Data were obtained from the patients' medical records. Logistic regression analyses were undertaken to identify the best combination of risk factors for predicting fatty liver using the backward (likelihood ratio) approach. The adjusted odds ratio and 95% confidence interval were estimated using the logistic regression coefficient. The prediction model was assessed using the receiver operating characteristic curve and the Hosmer-Lemeshow goodness-of-fit test and was validated on a new, prospective cohort. Statistical analysis was done using SPSS version 17.||RESULTS: A total of 1,054 cases was included in this study. Fatty liver was present in 538 (51.0%) patients. Bivariate analyses found associations among fatty liver and several risk factors. Six risk factors were incorporated to build the final prediction model. All scores were summed up to obtain the total score. A probability equation was developed by applying linear regression analysis on the total score. The prediction model had good diagnostic performance with an area under the receiver operating characteristic curve =0.833 (95% confidence interval =0.809-0.857). The Hosmer-Lemeshow goodness-of-fit P-value was 0.232, which indicated the appropriateness of the logistic regression model to predict fatty liver. On the validation set, the scoring system proved to be moderately accurate and can potentially be applied to larger population setting.||CONCLUSION: The presence of fatty liver in NAFLD patients can be predicted using our proposed fatty liver scoring system.","Diabetes, Metabolic Syndrome and Obesity : Targets and Therapy",2015,10.2147/DMSO.S80364,1178-7007,Fatty Liver||Scoring Model||Ultrasound||Community||Developing Countries||Diagnostic Performance,en,Journal Article,8,,213-218,https://www.ncbi.nlm.nih.gov/pmc/articles/PMC4410820/#
+,123456789/805,"Development, Translation and Validation of Enhanced Asian Rome III Questionnaires for Diagnosis of Functional Bowel Diseases in Major Asian Languages: A Rome Foundation-Asian Neurogastroenterology and Motility Association Working Team Report","Syam, Ari Fahrial||Abdullah, Murdani||Ghoshal, Uday C||Gwee, Kok-Ann||Chen, Minhu||Gong, Xiao R||Pratap, Nitesh||Hou, Xiaohua||Bak, Young-Tae||Choi, Myung-Gyu||Gonlachanvit, Sutep||Chua, Andrew S B||Chong, Kuck-Meng||Siah, Kewin T H||Lu, Ching-Liang||Xiong, Lishou||Whitehead, William E","The functional gastrointestinal disorders (FGIDs) are comprised of a group of conditions that are currently defined by the presence of certain symptoms attributable to the gastrointestinal (GI) tract, in the absence of organic causes identifiable by routine investigations.1 To harmonize research in this field, a framework known as the Rome Criteria was developed to attempt classification of patients into diagnostic labels based putatively on the sites of the GI tract and the pathophysiological disturbances implicated.2",Journal of Neurogastroenterology and Motility,2015,10.5056/jnm14045,2093-0879,Asia||Gastrointestinal Diseases||Rome III Criteria||Translations||Validation,en,Journal Article,21,1,83-92,https://www.ncbi.nlm.nih.gov/pmc/articles/PMC4288097/
+,123456789/805,Environmental Risk Factors in Inflammatory Bowel Disease: A Population-Based Case-Control Study in Asia-Pacific," Simadibrata, Marcellus||Abdullah, Murdani||Ng, Siew C||Tang, Whitney||Leong, Rupert W||Chen, Minhu||Ko, Yanna||Studd, Corrie||Niewiadomski, Ola||Bell, Sally||Kamm, Michael A||Silva, H J de||Kasturiratne, Anuradhani||Senanayake, Yasith Udara||Ooi, Choon Jin||Ling, Khoon-Lin||Ong, David||Goh, Khean Lee||Hilmi, Ida||Ouyang, Qin||Wang, Yu-Fang||Hu, PinJin||Zhu, Zhenhua||Zeng, Zhirong||Wu, Kaichun||Wang, Xin||Xia, Bing||Li, Jin||Pisespongsa, Pises||Manatsathit, Sathaporn||Aniwan, Satimai||Tsang, Steve W C||Wong, Tai Chiu||Hui, Aric J||Chow, Chung Mo||Yu, Hon Ho||Li, Mo Fong||Ng, Ka Kei||Ching, Jessica||Wu, Justin C Y||Chan, Francis K L||Sung, Joseph J Y ","Objective: The rising incidence of inflammatory bowel disease in Asia supports the importance of environmental risk factors in disease aetiology. This prospective population-based case-control study in Asia-Pacific examined risk factors prior to patients developing IBD. Design 442 incident cases (186 Crohn’s disease (CD); 256 UC; 374 Asians) diagnosed between 2011 and 2013 from eight countries in Asia and Australia and 940 controls (frequency-matched by sex, age and geographical location; 789 Asians) completed an environmental factor questionnaire at diagnosis. Unconditional logistic regression models were used to estimate adjusted ORs (aOR) and 95% CIs.||Results: In multivariate model, being breast fed >12 months (aOR 0.10; 95% CI 0.04 to 0.30), antibiotic use (aOR 0.19; 0.07 to 0.52), having dogs (aOR 0.54; 0.35 to 0.83), daily tea consumption (aOR 0.62; 0.43 to 0.91) and daily physical activity (aOR 0.58; 0.35 to 0.96) decreased the odds for CD in Asians. In UC, being breast fed >12 months (aOR 0.16; 0.08 to 0.31), antibiotic use (aOR 0.48; 0.27 to 0.87), daily tea (aOR 0.63; 0.46 to 0.86) or coffee consumption (aOR 0.51; 0.36 to 0.72), presence of hot water tap (aOR 0.65; 0.46 to 0.91) and flush toilet in childhood (aOR 0.71; 0.51 to 0.98) were protective for UC development whereas ex-smoking (aOR 2.02; 1.22 to 3.35) increased the risk of UC.||Conclusions: This first population-based study of IBD risk factors in Asia-Pacific supports the importance of childhood immunological, hygiene and dietary factors in the development of IBD, suggesting that markers of altered intestinal microbiota may modulate risk of IBD later in life.",Gut BMJ,2015,10.1136/gutjnl-2014-307410,1468-3288,,en,Journal Article,64,7,1063-1071,https://gut.bmj.com/content/64/7/1063
+,123456789/805,Factors Associated with In-stent Restenosis in Patients Following Percutaneous Coronary Intervention,"Wihanda, Dedi||Alwi, Idrus||Yamin, Muhammad||Shatri, Hamzah||Mudjaddid, E ","AIM: to determine factors associated with In-Stent Restenosis (ISR) in patients following Percutaneous Coronary Intervention (PCI).||METHODS: a retrospective cross-sectional study was conducted using secondary information from medical records of post-PCI patients who underwent follow-up of angiography PCI between January 2009 and March 2014 at The Integrated Cardiovascular Service Unit, Cipto Mangunkusumo Hospital, Jakarta. Angiographic ISR was defined when the diameter of stenosis 50% at follow-up angiography including the diameter inside the stent and diameter with five-mm protrusion out of the proximal and distal ends of the stent.||RESULTS: there were 289 subjects including 133 subjects with and 156 subjects without ISR. The incidence of ISR in patients using of bare-metal stent (BMS) and drug-eluting stent (DES) were 61.3% and 40.7%, respectively. Factors associated with ISR are stent-type (OR=4.83, 95% CI 2.51-9.30), stent length (OR=3.71, 95% CI 1.99-6.90), bifurcation lesions (OR=2.43, 95% CI 1.16-5.10), smoking (OR=2.30, 95% CI 1.33-3.99), vascular diameter (OR=2.18, 95% CI 1.2-3.73), hypertension (OR=2.16, 95% CI 1.16-4.04) and diabetes mellitus (OR=2.14, 95% CI 1.23-3.70).||CONCLUSION: stent type, stent length, bifurcation lesions, smoking, vascular diameter, hypertension and DM are factors associated with ISR in patients following PCI.",Acta Medica Indonesiana,2015,,2338 - 2732,Bare-Metal Stent||Drug-Eluting Stent||In-Stent Restenosis,en,Journal Article,47,3,209-215,http://www.inaactamedica.org/archives/2015/26586386.pdf
