id,collection,dc.title[en_US],dc.contributor.author[en_US],dc.description.abstract[en_US],dc.publisher,dc.date.issued,dc.identifier.doi,dc.identifier.issn,dc.subject,dc.language,dc.type,dc.publisher.volume,dc.publisher.issue,dc.publisher.page,dc.identifier.uri
123456789/955,123456789/697,Benefits of a Dedicated Breastfeeding Facility and Support Program for Exclusive Breastfeeding Among Workers in Indonesia,"Basrowi, Ray W||Sulistomo, Astrid B||Adi, Nuri Purwito||Vandenplas, Yvan ","Purpose: A mother's working environment is believed to be a major determinant of exclusive breastfeeding (EBF) practice. We aimed to define the influence of a facility dedicated to breastfeeding and a breastfeeding support program at the workplace on breastfeeding practice.||Methods: A cross-sectional study was performed in five workplaces. The inclusion criteria were female workers whose last child was between 6 and 36 months old. Observational data were obtained and a questionnaire was filled out. The World Health Organization definition for EBF was used.||Results: Data from 186 subjects (74 office workers and 112 factory workers) were collected. Just over half (52%) of the mothers were between 20 and 46 years old, 75.3% had graduated from high school and university, 12.9% had more than two children and 36.0% owned a house. The prevalence of EBF during the last 6 months was 32.3%. A proper dedicated breastfeeding facility was available for 21.5% of the mothers, but only 7.5% had been in contact with a breastfeeding support program. The presence of a dedicated breastfeeding facility increased EBF practice almost threefold, by an odds ratio (OR) of 2.74 and a 95% confidence interval (CI) of 1.34-5.64 (p<0.05). Knowledge of the breastfeeding support program increased EBF practice by almost six times (OR, 5.93; 95% CI, 1.78-19.79) (p<0.05).||Conclusion: Our findings suggest that Governments should make it obligatory for employers to offer a breastfeeding support program and a dedicated breastfeeding facility at the workplace as these simple measures significantly increase EBF.","Pediatric Gastroenterology, Hepatology & Nutrition",2015,10.5223/pghn.2015.18.2.94,2234-8646,Breast Feeding||Manpower||Dedicated Breastfeeding Facility||Breastfeeding Support Program,en,Journal Article,18,2,94-99,https://www.ncbi.nlm.nih.gov/pmc/articles/PMC4493252/
+,123456789/697,Effectiveness of the Bacillus Calmette-Guerin Vaccine in an Indonesian Population with D543N NRAMP1 Polymorphism,"Pakasi, Trevino A||Putera, Ikhwanuliman||Syahmar, Ikrar||Bramantyo, Aulia A||Karyadi, Elvina||Melani, Ani||Sahiratmadja, Edhyana ","Introduction: Bacille Calmette-Guerin (BCG) vaccination remains a routine immunization in primary care in tuberculosis (TB)-endemic areas, though several studies found that its efficacy was inconclusive. Natural resistance-asociated machrophage protein 1 (NRAMP1) polymorphism has been shown to result in higher susceptibility to TB. Information on genetic susceptibility in populations will be useful in planning the application of the BCG vaccine. The present study explored BCG efficacy in a rural Timor population with specific NRAMP1 polymorphism in a TB-endemic region of eastern Indonesia.||Methodology: A case-control study with 64 newly diagnosed pulmonary TB patients and 65 healthy controls was performed. BCG scars were examined by a physician. NRAMP1 polymorphism was evaluated using molecular methods.||Results: Half of the subjects (65; 50.4%) had a clear presenting BCG scar on the upper arm, suggesting a successful BCG vaccination. Among the subjects, D543N NRAMP1 polymorphism, history of contact with TB patients, and not having a clear BCG scar on the upper arm tended to be significantly association with active TB. The significant differences were more profound when subjects were divided based on presenting BCG scar. Subjects without clear BCG scars had significant association with developing TB disease (p = 0.014). In multivariate analysis, history of previous contact with TB patients and unclear presenting BCG scar were associated with active TB (OR 9.2; 2.0–43.8 95% CI, OR 4.8; 2.1–11.0 95% CI, respectively).||Conclusions: BCG vaccination in our population was effective for TB protection, especially in highly endemic areas of TB, regardless genetic susceptibility.",Journal of Infection in Developing Countries,2015,10.3855/jidc.5047,1972-2680,BCG Vaccination||Tuberculosis||NRAMP1||Polymorphism,en,Journal Article,9,1,42-47,https://jidc.org/index.php/journal/article/view/25596570/1229
+,123456789/779,A Double Blind Randomized Trial Showing Probiotics to be Ineffective in Acute Diarrhea in Indonesian Children,"Hegar, Badriul||Waspada, I Made Indra||Gunardi, Hartono||Vandenplas, Yvan ","OBJECTIVE: To investigate the efficacy of probiotics added to oral rehydration solution and zinc in the treatment of acute infectious diarrhea in Indonesian children.||METHODS: A prospective randomized double blind placebo-controlled trial was performed to test the efficacy of a probiotic food supplement in 112 children in the Kenari subdistrict, central Jakarta, aged 6-36 mo with acute infectious diarrhea and moderate dehydration. The supplemented group was given standard therapy (oral rehydration solution and zinc) and the probiotic strains Lactobacillus (L.) rhamnosus R0011 1.9 × 109 colony forming units (cfu) and L. acidophilus R0052 0.1 × 109 cfu/d for 7 d, while the control group was given standard therapy and placebo.||RESULTS: Median duration of diarrhea was 68.5 h (range 13-165) in the supplemented and 61.5 h (range 21-166) in the control group (P = 0.596). Median daily frequency of defecation until diarrhea stopped was 5.0 in the supplemented vs. 5.5 in the control group (P = 0.795).||CONCLUSIONS: This probiotic food supplement tested did not reduce the duration of acute infectious diarrhea as compared to oral rehydration and zinc.",Indian Journal of Pediatrics,2015,10.1007/s12098-014-1408-5,0973-7693,Acute Diarrhea||Acute Gastroenteritis||Lactobacillus||Oral Rehydration (solution)||Probiotic||Zinc,en,Journal Article,82,5,410-414,https://www.ncbi.nlm.nih.gov/pubmed/24777621
+,123456789/779,Cardiovascular Manifestations of HIV Infection in Children,"Idris, Nikmah S||Kurniati, Nia||Sastroasmoro, Sudigdo||Grobbee, Diederick E||Burgner, David||Cheung, Michael MH||Uiterwaal, Cuno SPM","BACKGROUND: HIV infection in children is now considered as a chronic condition, in which various non-infectious complications may occur, including those affecting the developing cardiovascular system. As children are expected to survive well into adulthood, understanding childhood as well as potential future cardiovascular complications is of major importance.||METHODS AND RESULTS: We reviewed published literature on childhood cardiac manifestations and longer term effects of pediatric HIV infection on the cardiovascular system. Evidence gaps that should be prioritized in research are highlighted. Through poorly understood mechanisms, HIV infection may cause various cardiac complications already manifesting in childhood, such as structural and functional myocardial derangements, pulmonary hypertension, pericardial effusion and possibly endocarditis. Evidence indicates that HIV infection in children also has unfavorable effects on the vasculature and cardiovascular biomarkers, such as increased intima-media thickness and decreased flow-mediated dilation, a marker of endothelial function. However, studies are small and predominantly include antiretroviral therapy-treated children, so that it is difficult to differentiate between effects of HIV infection per se and antiretroviral therapy treatment, reported in adults to have cardiovascular side effects.||CONCLUSIONS: HIV infection in children may greatly impact the cardiovascular system, including effects on the heart, which tend to manifest early in childhood, and on the vasculature. The underlying mechanisms, essential for targeted prevention, are poorly understood. Current evidence largely stems from research in adults. However, as modes of infection, immune maturity, growth and development, and treatment are markedly different in children, specific pediatric research, accounting for the complex interplay of normal growth and development, HIV infection and treatment, is clearly warranted.",European Journal of Preventive Cardiology,2014,10.1177/2047487314560086,2047-4873,Human Immunodeficiency Virus||Atherosclerosis||Cardiovascular|Children||Heart,en,Journal Article,22,11,1452-1461,https://journals.sagepub.com/doi/full/10.1177/2047487314560086?url_ver=Z39.88-2003&rfr_id=ori%3Arid%3Acrossref.org&rfr_dat=cr_pub%3Dpubmed#articleCitationDownloadContainer
+,123456789/779,Closed Catheter Access System Implementation in Reducing the Bloodstream Infection Rate in Low Birth Weight Preterm Infants,"Rundjan, Lily||Rohsiswatmo, Rinawati||Paramita, Tiara Nien||Oeswadi, Chrissela Anindita ","Background: Bloodstream infection (BSI) is one of the significant causes of morbidity and mortality encountered in a neonatal intensive care unit, especially in developing countries. Despite the implementation of infection control practices, such as strict hand hygiene, the BSI rate in our hospital is still high. The use of a closed catheter access system to reduce BSI related to intravascular catheter has hitherto never been evaluated in our hospital. Objective: To determine the effects of closed catheter access system implementation in reducing the BSI rate in preterm neonates with low birth weight.||Methods: Randomized clinical trial was conducted on 60 low birth weight preterm infants hospitalized in the neonatal unit at Cipto Mangunkusumo Hospital, Jakarta, Indonesia from June to September 2013. Randomized subjects either received a closed or non-closed catheter access system. Subjects were monitored for 2weeks for the development of BSI based on clinical signs, abnormal infection parameters, and blood culture.||Results: Closed catheter access system implementation gave a protective effect toward the occurrence of culture-proven BSI (relative risk 0.095, 95% CI 0.011–0.85, p D0.026). Risk of culture-proven BSI in the control group was 10.545 (95% CI 1.227–90.662, p D0.026). BSI occurred in 75% of neonates without risk factors of infection in the control group compared to none in the study group.||Conclusion: The use of a closed catheter access system reduced the BSI in low birth weight preterm infants. Choosing the right device design, proper disinfection of device, and appropriate frequency of connector change should be done simultaneously.",Frontiers in Pediatrics,2015,10.3389/fped.2015.00020,2296-2360,Bloodstream Infection||Central Line-Associated Bloodstream Infection||Closed Catheter Access System||Infection Control Practices||Needleless Connector||Preterm Infants,en,Journal Article,3,,20,https://www.ncbi.nlm.nih.gov/pmc/articles/PMC4360570/
+,123456789/779,Cost-Effectiveness Study of Pediatric Atopic Dermatitis in Asia: Atopiclair vs. Regular Emollient (AD-ATOP),"Munasir, Zakiudin||Tang, Mark B.Y.||Leong, Kin Fon||Ou, Liang-Shiou||Parekh, Pankaj R.||Azmi, Soraya||Low, Wilson||Goh, Adrian","BACKGROUND: Atopic dermatitis (AD) is a highly prevalent, chronic relapsing condition in childhood with significant financial burden and impact on the quality of life of patients and caregivers. Proactive maintenance treatment with moisturizing agents is the mainstay AD therapy.||OBJECTIVES: The aim of this study was to assess the cost-effectiveness of a non-steroidal barrier cream (Atopiclair), compared to regular emollient in pediatric patients with mild-to-moderate AD.||METHODS: A Markov decision model was developed to evaluate the cost-effectiveness of Atopiclair versus regular emollient in 12 Asia-Pacific countries, grouped by income categories based on gross domestic product (GDP) per capita. Data was obtained from structured literature review, expert opinion, fee schedules, and findings from a 2012 survey of 12 Asia-Pacific countries. Analysis was performed a societal perspective.||RESULTS: In the base case analysis, Atopiclair was cost-effective against regular emollient, with USD786, USD499, and USD289 in cost savings per year for high, middle, and low-income countries, respectively. Sensitivity analyses showed that Atopiclair remained cost-effective versus regular emollient.||CONCLUSIONS: Modelling analysis showed that Atopiclair is a cost-effective treatment compared to regular emollient for mild-to-moderate pediatric AD in the countries included in the study.<BR /><BR /> <EM>J Drugs Dermatol</EM>. 2015;14(2):169-175.",Journal of Drugs in Dermatology : JDD,2015,,,,en,Journal Article,14,2,169-175,https://jddonline.com/articles/dermatology/S1545961615P0169X/
+,123456789/779,Effects of Duration of Breastfeeding During Infancy on Vascular Dysfunction in Adolescents,"Putra, Sukman Tulus||Mansyur, Muchtaruddin||Satroasmoro, Sudigdo ","Aim: to investigate the effect of breastfeeding duration on vascular characteristics in adolescence.||Methods: we conducted a retrospective cohort study on adolescents aged 15-18 years old. Breastfeeding duration was inquired using a questionnaire filled by parents and categorized into 0-<2, 2-<4, 4-<6, 6-<12, and >12 months. Outcomes assessed were flow mediated dilation (FMD), carotid intima media thickness (CIMT), anthropometrics. Analysis was done using linear regression and MANOVA general linear model with cardiovascular risk factors as the dependent variables and breastfeeding duration as the independent variable with further adjustment for confounders.||Results: 285 subjects aged 15-18 years were enrolled. Breastfeeding duration of 4-<6 months was associated with thinner CIMT and the effect was more prominent after adjustment for gender and postnatal tobacco exposure (mean difference=24.28 micrometer, p=0.045). No statistically significant association was found with FMD.||Conclusion: breastfeeding duration of 4-<6 months is associated with thinner IMT and thus has a protective effect on the development of cardiovascular disease. However the association with FMD in adolescence is less clear. Key words: breastfeeding duration, vascular structure and function, cardiovascular risk",Acta Medica Indonesiana,2015,,2338-2732,Breastfeeding Duration||Vascular Structure and Function||Cardiovascular Risk,en,Journal Article,47,1,24-30,http://www.actamedindones.org/index.php/ijim/article/view/5/5
+,123456789/779,Efficacy and Long-Term Safety of a Dengue Vaccine in Regions of Endemic Disease,"Hadinegoro, Sri Rezeki||Arredondo-García, Jose Luis||Capeding, Maria Rosario||Deseda, Carmen||Chotpitayasunondh, Tawee||Dietze, Reynaldo||Ismail, Muhammad||Reynales, Humberto||Limkittikul, Kriengsak||Rivera-Medina, Doris Maribel||Tran, Huu Ngoc||Bouckenooghe, Alain||Chansinghakul, Danaya||Cortés, Margarita||Fanouillere, Karen||Forrat, Remi||Frago, Carina||Gailhardou, Sophia||Jackson, Nicholas||Noriega, Fernando||Plennevaux, Eric||Wartel, Anh||Zambrano, Betzana||Saville, Melanie","A candidate tetravalent dengue vaccine is being assessed in three clinical trials involving more than 35,000 children between the ages of 2 and 16 years in Asian-Pacific and Latin American countries. We report the results of long-term follow-up interim analyses and integrated efficacy analyses. Methods We are assessing the incidence of hospitalization for virologically confirmed dengue as a surrogate safety end point during follow-up in years 3 to 6 of two phase 3 trials, CYD14 and CYD15, and a phase 2b trial, CYD23/57. We estimated vaccine efficacy using pooled data from the first 25 months of CYD14 and CYD15. Results Follow-up data were available for 10,165 of 10,275 participants (99%) in CYD14 and 19,898 of 20,869 participants (95%) in CYD15. Data were available for 3203 of the 4002 participants (80%) in the CYD23 trial included in CYD57. During year 3 in the CYD14, CYD15, and CYD57 trials combined, hospitalization for virologically confirmed dengue occurred in 65 of 22,177 participants in the vaccine group and 39 of 11,089 participants in the control group. Pooled relative risks of hospitalization for dengue were 0.84 (95% confidence interval [CI], 0.56 to 1.24) among all participants, 1.58 (95% CI, 0.83 to 3.02) among those under the age of 9 years, and 0.50 (95% CI, 0.29 to 0.86) among those 9 years of age or older. During year 3, hospitalization for severe dengue, as defined by the independent data monitoring committee criteria, occurred in 18 of 22,177 participants in the vaccine group and 6 of 11,089 participants in the control group. Pooled rates of efficacy for symptomatic dengue during the first 25 months were 60.3% (95% CI, 55.7 to 64.5) for all participants, 65.6% (95% CI, 60.7 to 69.9) for those 9 years of age or older, and 44.6% (95% CI, 31.6 to 55.0) for those younger than 9 years of age. Conclusions Although the unexplained higher incidence of hospitalization for dengue in year 3 among children younger than 9 years of age needs to be carefully monitored during long-term follow-up, the risk among children 2 to 16 years of age was lower in the vaccine group than in the control group.",The New England Journal of Medicine,2015,10.1056/NEJMoa1506223,0028-4793,,en,Journal Article,373,13,1195-1206,https://www.nejm.org/doi/full/10.1056/NEJMoa1506223
+,123456789/779,Gluten and Casein Supplementation does not Increase Symptoms in Children with Autism Spectrum Disorder,"Pusponegoro, Hardiono D.||Ismael, Sofyan||Firmansyah, Agus||Sastroasmoro, Sudigdo||Vandenplas, Yvan ","AIM: A gluten- and casein-free diet is often given to children with autism spectrum disorder (ASD). We aimed to determine the effect of gluten and casein supplementation on maladaptive behaviour, gastrointestinal symptom severity and intestinal fatty acids binding protein (I-FABP) excretion in children with ASD.||METHODS: A randomised, controlled, double-blind trial was performed on 74 children with ASD with severe maladaptive behaviour and increased urinary I-FABP. Subjects were randomised to receive gluten-casein or a placebo for seven days. We evaluated maladaptive behaviour before and after supplementation, using I-FABP excretion, the approach withdrawal problem composite subtest of the Pervasive Developmental Disorder Behavior Inventory and the Gastrointestinal Symptom Severity Index.||RESULTS: The mean approach withdrawal problem composite score was significantly higher before supplementation than after, both in the placebo and in the gluten-casein group. However, the mean difference was not significant and may have been caused by additional therapy. There was no significant difference in gastrointestinal symptoms and urinary I-FABP excretion.||CONCLUSION: Administrating gluten-casein to children with ASD for one week did not increase maladaptive behaviour, gastrointestinal symptom severity or urinary I-FABP excretion. The effect of prolonged administration or other mechanisms of enterocyte damage in ASD should be explored.",Acta Paediatrica,2015,10.1111/apa.13108,0803-5253,Autism Spectrum Disorder||Casein-Free Diet||Gluten-Free||Intestinal Fatty Acids Binding Protein||Maladaptive Behaviour,en,Journal Article,104,11,e500-e505,https://onlinelibrary.wiley.com/doi/full/10.1111/apa.13108
+,123456789/779,Growth of Indonesian Infants Compared with World Health Organization Growth Standards,"Dwipoerwantoro, Pramita Gayatri||Mansyur, Muchtaruddin||Oswari, Hanifah||Firmansyah, Agus||Makrides, Maria||Cleghorn, Geoffrey ","OBJECTIVES: The ability of the World Health Organization (WHO) growth standards to represent the growth of South East Asian infants has been questioned. The aim of this study was to provide contemporary data on the growth of Indonesian breast-fed and formula-fed infants, compared with the WHO growth standards.||METHODS: A prospective cohort study of 160 normal healthy infants was undertaken in a suburban area of South Jakarta, Indonesia. Infants from 2 to 6 weeks of age were recruited, and they consumed exclusively either breast milk or infant formula for at least 6 months, with follow-up until 12 months of age.||RESULTS: Overall, the infants in the present study were lighter (weight-for-age), were shorter (length-for-age), and had smaller head circumferences (head circumference-for-age) than the average WHO Growth Reference Study population but were of similar proportion (weight-for-length). Compared with the WHO Growth Reference Study, the z scores for weight-for-age, length-for-age, and head circumference-for-age in the Indonesian children fell from birth to 6 weeks of age and then increased until 3 months of age in both the breast-fed and the formula-fed infants. At 6 weeks of age, the weight-for-age z scores fell below -2 standard deviations for 16 (20.5%) breast-fed and 40 (51.3%) formula-fed infants, and the length-for-age z scores fell below -2 standard deviations for 31 (39.7%) breast-fed and 41 (52.6%) formula-fed infants.||CONCLUSION: The WHO growth standards do not reflect the growth of the present cohort of Indonesian infants and may overestimate the levels of underweight and stunted children.",Journal of Pediatric Gastroenterology and Nutrition,2015,10.1097/MPG.0000000000000770,1536-4801,Asian||Breast Milk||Formula||Growth||Indonesia||Infants,en,Journal Article,61,2,248-252,https://www.ncbi.nlm.nih.gov/pmc/articles/PMC4523192/
+,123456789/795,A Guidance to Diagnose Crusted Scabies in Clinical Practice,"Nainggolan, Evelyn Lina||Riana, Imelda||Komarasari, Eka||Novianto, Endi||Rahmayunita, Githa||Jacoeb, Tjut Nurul Alam ",Crusted scabies (CS) is a parasitic infestation of Sarcoptes scabiei in large quantities and highly contagious. This disease usually occurs in immunocompromised patient. Misdiagnosis is frequently happened due to uncharacteristic clinical features. We report three cases of CS which had been misdiagnosed and treated improperly,Journal of the American Academy of Dermatology (JAAD),2015,10.1016/j.jaad.2015.02.511,0190-9622,,en,Journal Article,72,5,AB123,http://www.jaad.org/article/S0190-9622(15)00630-1/abstract
+,123456789/795,A Rare Case of Late Onset Reticulate Acropigmentation of Kitamura Without Involvement of the Palms and Soles,"Melly, Conny||Sularsito, Sri Addi||Sirait, Sondang Panjaitan||Rihatmadja, Rahadi||Widyasari, Indah||Onmaya, Vini ","Reticulate acropigmentations of Kitamura (RAPK) is an autosomal dominant inherited disorder characterized by pigmented, angulated, irregular freckle-like lesion with atrophy on the surface, arranged in a reticulate pattern on the dorsa of the hands and feet. It was first described by Kitamura and Akamatsu in Japan in 1943. The usual age of onset is the first and second decades of life. Palms and soles reveal pits and breaks in the epidermal ridge pattern. The histopathological examination show epidermal atrophy, digitate and filiform elongated rete ridges with clumps of heavy melanin pigmentation at their tips. Case: A 59-year-old male presented with asymptomatic and progressive brownish-black discoloration in a reticulate pattern on the dorsal aspect of his hands and feet. The lesions initially appeared when the patient was 45 years old. It was not preceded by any erythema or inflammation. There was no similar case in the family. Laboratory findings were within normal limits. Discussion: Skin biopsy taken from the dorsal of the hand and foot revealed hyperkeratosis, thinning of epithelium, filiform elongation of the rete ridges, increased melanocyte numbers in the basal layer, and lymphocyte infiltration in the dermis. Based on the clinical and histological findings he was diagnosed as RAPK. From some reports, sporadic cases without the involvement of other family members may occur, like our patient. Palms and soles involvement in RAPK is still debated, some considered it as a characteristic sign of this disorder while others refuted it.",Journal of General-Procedural Dermatology & Venereology Indonesia,2015,10.19100/jdvi.v1i1.5,2460-7991,Reticulate Acropigmentation of Kitamura||Histopathology||Late Onset||Sporadic,en,Journal Article,1,1,25-28,http://jgenprodvi.ui.ac.id/index.php/jdvi/article/view/5
